{
  "runtime": "sentra-promotion-input-v1",
  "generatedAt": "2026-06-06T05:45:54.886Z",
  "sourceArtifact": "sentra/snapshot.json",
  "goal": "Promotion History Ledger",
  "constraints": [
    "Use current Sentra operating state",
    "Preserve Hermes domain logic outside framework code",
    "Keep promotion artifact-backed",
    "Require explicit review for promotion"
  ],
  "context": [
    "Project: Hermes Agentic Workflow — Set up Hermes so selected work can move from recommendation into autonomous or semi-autonomous execution.",
    "Decision: Promote Mastra for controlled Hermes orchestration use.",
    "Review: Mastra qualified for controlled use after real suspend/resume, persistence, external human input, failure recovery, and Langfuse visibility.",
    "Priority 1: Promotion History Ledger — Promotion decisions should accumulate as a durable, queryable operating history.",
    "Priority 2: Multi-project Prioritization — Sentra should choose between multiple active projects instead of only operating Hermes Mastra Lab.",
    "Priority 3: Weekly Review Feedback — Weekly reviews should update priorities and stale risks instead of only reporting them."
  ],
  "notes": [
    "This is generated from Sentra operating state.",
    "Sentra owns current operating context; Hermes owns recommendation and promotion.",
    "Promotion input should not be edited directly unless debugging."
  ]
}
